{
  "version": "0.3.0",
  "operators": {
    "⊗": {
      "symbol": "⊗",
      "name": "fusion",
      "directionality": "UNDIRECTED",
      "signature": {
        "left": "StateLike",
        "right": "StateLike",
        "returns": "Fusion"
      },
      "laws": {
        "closure": {
          "status": "PROVEN",
          "basis": "Both operands require StateLike and every result is a StateLike subtype.",
          "witness": "type lattice and operator signatures",
          "counterexample": null,
          "value": null
        },
        "operational_reversibility": {
          "status": "DOMAIN_DEPENDENT",
          "basis": "The symbolic core does not execute domain state changes.",
          "witness": null,
          "counterexample": null,
          "value": null
        },
        "identity_element": {
          "status": "UNDECLARED",
          "basis": "No universal identity has been justified for the core operator.",
          "witness": null,
          "counterexample": null,
          "value": null
        },
        "annihilator": {
          "status": "UNDECLARED",
          "basis": "No universal annihilator has been justified for the core operator.",
          "witness": null,
          "counterexample": null,
          "value": null
        },
        "commutative": {
          "status": "PROVEN",
          "basis": "Canonical fusion operands are sorted by canonical form.",
          "witness": "A ⊗ B ≡ B ⊗ A",
          "counterexample": null,
          "value": null
        },
        "associative": {
          "status": "PROVEN",
          "basis": "Nested fusion nodes flatten to one n-ary fusion.",
          "witness": "(A ⊗ B) ⊗ C ≡ A ⊗ (B ⊗ C)",
          "counterexample": null,
          "value": null
        },
        "idempotent": {
          "status": "REFUTED",
          "basis": "Duplicate fusion operands are preserved.",
          "witness": null,
          "counterexample": "A ⊗ A ≢ A",
          "value": null
        },
        "structural_inverse": {
          "status": "UNDECLARED",
          "basis": "No inverse fusion operator exists in the core.",
          "witness": null,
          "counterexample": null,
          "value": null
        },
        "termination": {
          "status": "NOT_APPLICABLE",
          "basis": "Fusion does not introduce iteration.",
          "witness": null,
          "counterexample": null,
          "value": null
        }
      },
      "normalization_rules": [
        "flatten nested fusion",
        "sort operands by canonical form",
        "preserve duplicate operands"
      ],
      "prohibited_inferences": [
        "do not infer idempotence",
        "do not infer an identity element",
        "do not infer semantic blending outside an adapter"
      ],
      "semantic_boundary": "Fusion represents structural composition only. It does not prove compatibility, agreement, or safe merger.",
      "contract_hash": "0fa9d28975d6245ac5f1b6f6ecd83b0a4469b323a379fce3153a098753e731e0"
    },
    "→": {
      "symbol": "→",
      "name": "projection",
      "directionality": "DIRECTED",
      "signature": {
        "left": "StateLike",
        "right": "StateLike",
        "returns": "Path"
      },
      "laws": {
        "closure": {
          "status": "PROVEN",
          "basis": "Both operands require StateLike and every result is a StateLike subtype.",
          "witness": "type lattice and operator signatures",
          "counterexample": null,
          "value": null
        },
        "operational_reversibility": {
          "status": "DOMAIN_DEPENDENT",
          "basis": "The symbolic core does not execute domain state changes.",
          "witness": null,
          "counterexample": null,
          "value": null
        },
        "identity_element": {
          "status": "UNDECLARED",
          "basis": "No universal identity has been justified for the core operator.",
          "witness": null,
          "counterexample": null,
          "value": null
        },
        "annihilator": {
          "status": "UNDECLARED",
          "basis": "No universal annihilator has been justified for the core operator.",
          "witness": null,
          "counterexample": null,
          "value": null
        },
        "commutative": {
          "status": "REFUTED",
          "basis": "Projection preserves operand order.",
          "witness": null,
          "counterexample": "A → B ≢ B → A",
          "value": null
        },
        "associative": {
          "status": "PROVEN",
          "basis": "Nested projection nodes flatten into an ordered path.",
          "witness": "(A → B) → C ≡ A → (B → C)",
          "counterexample": null,
          "value": null
        },
        "idempotent": {
          "status": "REFUTED",
          "basis": "Repeated path nodes remain explicit.",
          "witness": null,
          "counterexample": "A → A ≢ A",
          "value": null
        },
        "structural_inverse": {
          "status": "UNDECLARED",
          "basis": "Reversing a path is not an equivalence rule.",
          "witness": null,
          "counterexample": null,
          "value": null
        },
        "termination": {
          "status": "NOT_APPLICABLE",
          "basis": "Projection does not introduce iteration.",
          "witness": null,
          "counterexample": null,
          "value": null
        }
      },
      "normalization_rules": [
        "flatten nested projection",
        "preserve exact left-to-right order",
        "preserve repeated states"
      ],
      "prohibited_inferences": [
        "do not reverse the path",
        "do not infer causality",
        "do not infer mutation of the left operand"
      ],
      "semantic_boundary": "Projection is an ordered symbolic path. Domain adapters decide whether it means transition, mapping, causation, or another relation.",
      "contract_hash": "459ba538a30e199aa4a4a1d6a31a9ba7707bd9912340882d388e9e25186a1593"
    },
    "⇌": {
      "symbol": "⇌",
      "name": "exchange",
      "directionality": "SYMMETRIC",
      "signature": {
        "left": "StateLike",
        "right": "StateLike",
        "returns": "Exchange"
      },
      "laws": {
        "closure": {
          "status": "PROVEN",
          "basis": "Both operands require StateLike and every result is a StateLike subtype.",
          "witness": "type lattice and operator signatures",
          "counterexample": null,
          "value": null
        },
        "operational_reversibility": {
          "status": "DOMAIN_DEPENDENT",
          "basis": "The symbolic core does not execute domain state changes.",
          "witness": null,
          "counterexample": null,
          "value": null
        },
        "identity_element": {
          "status": "UNDECLARED",
          "basis": "No universal identity has been justified for the core operator.",
          "witness": null,
          "counterexample": null,
          "value": null
        },
        "annihilator": {
          "status": "UNDECLARED",
          "basis": "No universal annihilator has been justified for the core operator.",
          "witness": null,
          "counterexample": null,
          "value": null
        },
        "commutative": {
          "status": "PROVEN",
          "basis": "Exchange operands are canonically ordered.",
          "witness": "A ⇌ B ≡ B ⇌ A",
          "counterexample": null,
          "value": null
        },
        "associative": {
          "status": "REFUTED",
          "basis": "Nested exchange grouping remains significant.",
          "witness": null,
          "counterexample": "(A ⇌ B) ⇌ C ≢ A ⇌ (B ⇌ C)",
          "value": null
        },
        "idempotent": {
          "status": "REFUTED",
          "basis": "Self-exchange remains an explicit relation.",
          "witness": null,
          "counterexample": "A ⇌ A ≢ A",
          "value": null
        },
        "structural_inverse": {
          "status": "PROVEN",
          "basis": "The structural inverse of exchange is itself.",
          "witness": "inverse(⇌) = ⇌",
          "counterexample": null,
          "value": "SELF"
        },
        "termination": {
          "status": "NOT_APPLICABLE",
          "basis": "Exchange does not introduce iteration.",
          "witness": null,
          "counterexample": null,
          "value": null
        }
      },
      "normalization_rules": [
        "sort the two direct operands",
        "preserve nested grouping"
      ],
      "prohibited_inferences": [
        "do not flatten nested exchanges",
        "do not infer operational reversibility",
        "do not infer equal value transfer"
      ],
      "semantic_boundary": "Exchange is structurally symmetric. Whether an actual exchange can be undone is domain-dependent.",
      "contract_hash": "68f6c7ba48294018759cab54800ad6c4d07c730ae29db0d20eb9b4dfb7917a11"
    },
    "⟲": {
      "symbol": "⟲",
      "name": "recurrence",
      "directionality": "DIRECTED",
      "signature": {
        "left": "StateLike",
        "right": "StateLike",
        "returns": "Recurrence"
      },
      "laws": {
        "closure": {
          "status": "PROVEN",
          "basis": "Both operands require StateLike and every result is a StateLike subtype.",
          "witness": "type lattice and operator signatures",
          "counterexample": null,
          "value": null
        },
        "operational_reversibility": {
          "status": "DOMAIN_DEPENDENT",
          "basis": "The symbolic core does not execute domain state changes.",
          "witness": null,
          "counterexample": null,
          "value": null
        },
        "identity_element": {
          "status": "UNDECLARED",
          "basis": "No universal identity has been justified for the core operator.",
          "witness": null,
          "counterexample": null,
          "value": null
        },
        "annihilator": {
          "status": "UNDECLARED",